{
  "$schema": "../connector-compatibility.schema.json",
  "schema_version": 1,
  "connector": {
    "number": 1,
    "id": "perfetto",
    "name": "Perfetto",
    "version": "0.7.0",
    "adapter_contract": "v58",
    "compatible_relu_core_versions": ["0.7.0"]
  },
  "public_baseline": {
    "repository": "https://github.com/google/perfetto.git",
    "release": "v58.2",
    "tag_ref": "refs/tags/v58.2",
    "tag_object_sha": "9e9bdafee101a7bb2eac57f60d14c5ec1fa30989",
    "commit_sha": "add693d8b338ba9599dbcbc3e300b1ab8c000897",
    "short_commit": "add693d8"
  },
  "integration": {
    "plugin_id": "io.company.RELUPerfettoBridge",
    "source_plugin_path": "plugin/io.company.RELUPerfettoBridge",
    "source_adapter_path": "perfetto_adapter",
    "target_plugin_path": "ui/src/plugins/io.company.RELUPerfettoBridge",
    "target_adapter_path": "ui/src/perfetto_adapter",
    "default_plugins_file": "ui/src/core/embedder/default_plugins.ts",
    "enable_patch": "integration/patches/perfetto-v58.2-enable-default-plugin.patch"
  },
  "company_integration_policy": {
    "metadata_scope": "company-internal-only",
    "exact_head_required": true,
    "company_adapter_must_be_external": true,
    "external_release_metadata_allowed": false
  },
  "security_policy": {
    "company_source_allowed_in_external_repository": false,
    "company_trace_allowed_in_external_repository": false,
    "credential_allowed_in_release_bundle": false,
    "telemetry_allowed": false,
    "runtime_remote_code_loading_allowed": false
  }
}
